,tweet_id,retweet_count,favorite_count,cleaned_tweet,length_before,length_after,ratio_of_length,number_of_upper_chars,has_question_marks,number_of_question_marks,has_exclamations,number_of_exclamation_marks,label
0,1241025578527903750,187425,954568,for the average american the best way to tell if you have covid-19 is to cough in a rich person’s face and wait for their test results,134,134,1.0,2,0,0,0,0,0
1,1240467080954228737,333831,1505405,this is fucking bullshit,24,24,1.0,0,0,0,0,0,0
2,1240716889162018816,160323,660762,can y’all please just follow the government’s instructions so we can knock this covid-19 out and be done?! i feel like a kindergartner that keeps losing more recess time because one or two kids can’t follow directions.,218,218,1.0,7,1,1,1,1,0
3,1241062514886090754,154086,368883,no offense but the corona virus disappearing before april actually sucks,72,72,1.0,2,0,0,0,0,0
4,1241447017945223169,126506,445713,"this is the face of someone who just spent 9 hours in personal protective equipment moving critically ill covid19 patients around london. i feel broken - and we are only at the start. i am begging people, please please do social distancing and self isolation covid19 URL",292,270,0.9246575342465754,7,0,0,0,0,1
5,1241637320325029889,128634,715158,"yesterday i knocked on my tennant's door and told him he can stay in the property rent free for 5 months. he is self employed with 4 kids. i don't need boris to tell me what is morally correct. landlords, if you can, do more, do something. covid19 benice",256,254,0.9921875,14,0,0,0,0,1
6,1241519420628963330,120821,487573,"after covid-19 is over, i better never hear anyone trash “low end” workers again. those people at the grocery store, the dollar general workers, those fast food workers, the walmart employees, those people you didn't even think deserved to have a wage to survive on?",266,266,1.0,16,1,1,0,0,0
7,1242137430322446344,119536,331428,this is dr. usama riaz. he spent past weeks screening and treating patients with corona virus in pakistan. he knew there was no ppe. he persisted anyways. today he lost his own battle with coronavirus but he gave life and hope to so many more. know his name URL,289,261,0.903114186851211,29,0,0,0,0,1
8,1240717039377022977,141115,516085,fun fact: its tradition for europeans to spread a potentially fatal disease to every other country not fully inhabited by white people &amp; not take accountability for the subsequent devastation &amp; lives lost,212,212,1.0,0,0,0,0,0,1
9,1240334979701395458,181436,763800,when this corona shit passes we have to promise each other that we’re going to tell our kids that we survived a zombie apocalypse in 2020,137,137,1.0,2,0,0,0,0,0
10,1241161304771039233,109785,554867,শ্বাসকষ্ট এতটা করণীয় লক্ষণ ঠিক তবে আপনি জানেন কী আমাকে শ্বাসকষ্টও দেয়? দুশ্চিন্তা। এবং আপনি কি আমাকে উদ্বেগ দিচ্ছেন জানেন? ভাবছি আমার করোনা আছে,180,180,1.0,5,1,2,0,0,0
11,1240676575168921600,100742,322476,"so, the last week i have been battling covid-19 &amp; pneumonia. never in my life have i been this ill. “young people aren’t at risk, they’ll only have mild symptoms” wrong. i want to open up about the difficulties i’ve gone through these past days, what it was like in the icu...",282,280,0.9929078014184397,17,0,0,0,0,1
12,1242125087886761987,107073,401952,আমার মা হোয়াটসঅ্যাপ বিশ্ববিদ্যালয় থেকে করোনার ভাইরাস নিয়ে পিএইচডি করেছেন,57,57,1.0,8,0,0,0,0,1
13,1240768501452697600,116644,415942,তিনি ধনী বন্ধুদের বলেছিলেন। তারপরে স্টকটিতে একটি দুর্দান্ত $ 1.4m আউট করা হয়েছে। তারপরে কোভিড -১৯ ত্রাণ বিলের বিরুদ্ধে ভোট দিয়েছিল। তাকে যেতে হবে,123,123,1.0,11,0,0,0,0,1
14,1241447267502116864,91414,383681,"ভবিষ্যতের নাতি: ""আরে দাদু কর্নো চান?"" আমি: ইউআরএল",74,53,0.7162162162162162,3,1,1,0,0,0
15,1241337295606657033,89425,196789,কোরিয়া 10 মিনিটের কোভিড -19 ডায়াগোনস্টিক কিটটি বিকাশ শেষ করেছে এবং এখন উত্পাদন বাড়িয়ে তুলছে। তারা প্রতি সপ্তাহে 300.000 টেস্ট-কিট রফতানি করার পরিকল্পনা করে - URL,170,150,0.8823529411764706,8,0,0,0,0,1
16,1241429041011478529,88884,284776,"দ্বিগুণ আত্মহত্যা, কোভিড -১ he হেই, তাই, ওম, এখন ঘরে ঘরে একটি বড় হাতি আছে। কোভিড এখনই একমাত্র মহামারী হচ্ছে না - এবং এটি একটি খারাপ, খারাপ সময়ে এসেছিল। কখনও ভাল সময় হয় না। একটি মানসিক স্বাস্থ্য মহামারী ঘটছে, এবং আমরা দেখতে শুরু করব-",276,274,0.9927536231884058,13,0,0,0,0,1
17,1242414259407130624,97800,358439,সেলিব্রিটিরা ভাইরাসটি দূরে সরিয়ে দেওয়ার চেষ্টা করে চলেছেন এটি একটি ডিজনি চলচ্চিত্র বা অন্য কিছু,87,87,1.0,2,0,0,0,0,0
18,1241973404992802818,85596,296774,আমি যদি কোভিড -১৯ এর অনুভূতি বিকাশ করি তবে এটি চলে যাবে,54,54,1.0,0,0,0,0,0,0
19,1241057919128526856,79256,391801,থ্রেড: আমি প্রায়শই এখানে চলচ্চিত্রের বিষয়ে কথা বলি তবে এখানে যায়। আমরা বর্তমানে সম্পূর্ণরূপে স্বল্প সরবরাহে অস্ত্রোপচারের মুখোশ এবং অন্যান্য মেডিকেল পোশাক তৈরির জন্য আমাদের কারখানাটিকে চালিত করছি। আমরা দিনে 2 মিলিয়ন মুখোশ তৈরি করতে পারি এবং এই সময়ের মধ্যে যে কোনও উপায়ে সম্ভব সহায়তা করতে চাইছি। covid19 URL,300,279,0.93,19,0,0,0,0,1
20,1240633773965918210,187182,850193,আমার মনস বাড়িটি বৃহস্পতিবার 6 টি ভিসোডিন পপ করবে এবং শনিবার সকালে এই নিরাময় হবে।,85,85,1.0,5,0,0,0,0,0
21,1241254183979765761,76400,315373,"আমি প্রায় সবকিছু ঠিকঠাক করেছি। বাড়িতে কাজ। গত 10 দিনে এক বন্ধুকে দেখেছি। একটি বড় টেবিলের দু'পাশে একটি পাবের বাইরে এক ঘন্টার জন্য একটি বিয়ার ছিল। টাটকা বায়ু, কোন যোগাযোগ নেই। আমার হাত 3 বার ধুয়েছি এখনও তার কাছ থেকে করোনাকে ধরেছিল এই জিনিসটি দিয়ে চারপাশে চোদো না।",266,262,0.9849624060150376,8,0,0,0,0,1
22,1241465915486670848,86484,390882,আমি বুঝতে পারি না যে এমসিডোনাল্ডস প্রতি বছর কীভাবে দুই বিলিয়ন হ্যামবার্গার পরিবেশন করতে পারে তবে আমি যখন ড্রাইভের মাধ্যমে পাঁচ মিলিয়ন অর্ডার করি তখন এটি সিস্টেমকে ছাপিয়ে যায়,150,150,1.0,2,0,0,0,0,0
23,1241009089091600392,74262,259407,ব্রো চিনা এখানে নিগাস পাওয়ার স্তরগুলি পড়ছে এবং আমরা পর্যাপ্ত পরীক্ষাও করতে পারি না,89,87,0.9775280898876404,2,0,0,0,0,0
24,1241466219791822849,80267,271769,এই করোনার বিষ্ঠা শেষ হয়ে গেলে আমাকে আমন্ত্রণ জানান। আমি জানি আমি মাঝে মাঝে ঝলকানি হয়ে থাকি তবে আমার পাছা বাইরে চলে আসবে আমি প্রতিশ্রুতি করব লোল,129,129,1.0,4,0,0,0,0,0
25,1241871812591419392,83021,157590,"তুমি তোমার প্রাক্তনকে মিস কর, আমি করোনার ভাইরাস ছাড়াই জীবনকে মিস করি",56,56,1.0,2,0,0,0,0,0
26,1241696164782669824,74313,167262,"“আমি তাকে থামিয়ে দিয়ে বললাম, দেখুন, এটা কোনও সিনেমা নয়। আপনি স্মিত হবেন না আমি কিংবদন্তি। বাড়িতে যেতে."" কোভিড ১৯ কোয়ারেন্টাইন লঙ্ঘনকারী লোকদের কাছে এটি হারাতে ইটালিয়ান মেয়রদের আপডেট সংকলন। হ্যাঁ, সাবটাইটেলগুলি সঠিক। URL টি",254,233,0.9173228346456693,16,0,0,0,0,0
27,1241287878354677760,71567,142812,"আপনার চিকিত্সকের পরামর্শ না থাকলে দয়া করে কোভিড ১৯-এর জন্য হাইড্রোক্সাইক্লোরোকুইন (প্লাকুইনিল) প্লাস অ্যাজিথ্রোমাইসিন গ্রহণ করবেন না। উভয় ওষুধই আপনার হার্টের Qt ব্যবধানকে প্রভাবিত করে এবং এরিথমিয়া এবং হঠাৎ মৃত্যুর কারণ হতে পারে, বিশেষত যদি আপনি অন্য মেডিস গ্রহণ করছেন বা হার্টের অবস্থা রয়েছে।",274,273,0.9963503649635036,17,0,0,0,0,1
28,1240335912329977858,282177,1357794,দিন 5: আমরা কৃষিকাজটি পুনরায় আবিষ্কার করেছি,35,35,1.0,2,0,0,0,0,0
29,1241902001539203073,66818,217083,এই করোনার ভাইরাস মধ্য এপ্রিল পেরিয়ে যাবে !! এটি অস্তিত্ব মধ্যে কথা বলা,70,70,1.0,4,0,0,1,2,1
30,1242302400762908685,70258,134503,আপনার সমর্থন এবং উত্সাহের অবিশ্বাস্য বার্তাগুলির জন্য সবাইকে ধন্যবাদ। আপনারা অনেকেই জিজ্ঞাসা করেছিলেন এখনই এটিকে কেমন দেখাচ্ছে। আমি আপনার সাথে কিছুটা ভাগ করতে চাই অনুগ্রহ করে আরটি করুন: কোনও এআর ডকের জীবনে একটি দিন - কোভিড ১৯ ফ্রন্টলাইন থেকে একটি সংক্ষিপ্ত প্রেরণ:,259,254,0.9806949806949807,23,0,0,0,0,0
31,1242476408896507910,71031,271277,"আমার সহকর্মীরা, আতঙ্কিত হওয়ার দরকার নেই। প্রয়োজনীয় পণ্য, ওষুধ ইত্যাদি পাওয়া যেত। কেন্দ্র এবং বিভিন্ন রাজ্য সরকার এটি নিশ্চিত করার জন্য নিবিড় সমন্বয় করে কাজ করবে। একসাথে, আমরা কোভিড -১৯ এর বিরুদ্ধে লড়াই করব এবং একটি স্বাস্থ্যকর ভারত তৈরি করব। জয় হিন্দ!",279,273,0.978494623655914,42,0,0,1,1,1
32,1241528549183385601,60980,245134,না .. এক ... গ্যাস্টনের মতো গ্যাস্টন কোয়ারানটাইনগুলির মতো পরিষ্কার,99,98,0.98989898989899,8,0,0,0,0,1
33,1241247329572683776,61815,169099,এই কারণেই ফ্লোরিডায় সৈকত বন্ধ হয়নি এবং কেন তারা ন্যূনতম কোভিড -19 প্রতিরোধ করেছে। পরম কর্মহীনতা। URL টি,145,125,0.8620689655172413,9,0,0,0,0,1
34,1241403715036291072,60724,155240,"আমার নতুন পছন্দের জিনিসটি হ'ল ইতালীয় মেয়র এবং আঞ্চলিক রাষ্ট্রপতিরা পৃথকীকরণ লঙ্ঘনকারী লোকদের দ্বারা এটি হারাচ্ছেন। এখানে একটি eng সাবটাইটেল সংকলন। “আমি শুনেছি আপনি স্নাতক দল নিক্ষেপ করতে চান। আমি পুলিশকে পাঠিয়ে দেব শিখার সাথে। "" কোভিড 19 করোন ভাইরাস ইউআরএল",286,264,0.9230769230769231,21,0,0,0,0,0
35,1240987594080559105,55029,85056,"covid-19 finally, some sensible advice from a nurse “what i have seen a lot of are recommendations for how to try to avoid getting coronavirus in the first place -- good hand washing, personal hygiene and social distancing -- but what i have not seen a lot of is advice for...",278,276,0.9928057553956835,13,0,0,0,0,0
36,1240666954958069768,65580,376602,"করোনার ভাইরাস বাস্তব নয়, সরকার কেবল দুই সপ্তাহের জন্য সবাইকে চায় যাতে তারা পাখির ব্যাটারি পরিবর্তন করতে পারে।",127,127,1.0,2,0,0,0,0,1
37,1241359584784044033,67049,74143,কোয়ারান্টিনের 6 দিন: আমার বাবা বিড়ালদের সাথে কোভিড -19 ইউআরএল সম্পর্কে একটি কথা বলেছেন,99,70,0.7070707070707071,5,0,0,0,0,0
38,1240620727306510342,104845,417370,"এই জেনারেশন জেড। আমি নামটি রাখতে চাই কারণ লোকেরা 40 বছর এবং হাজার বছরের অধীনে সবাইকে কল করতে পছন্দ করে। সহস্রাব্দগুলি বসন্ত বিরতিতে নয়। সহস্রাব্দগুলি ঘরে বসে তাদের বুড়ো পিতামাতার দিকে চিত্কার করে যাঁরা স্থির হয়ে বসে থাকবেন না কারণ তাদের ""ভয়ের উপরে বিশ্বাস"" রয়েছে।",258,254,0.9844961240310077,10,0,0,0,0,1
39,1240780691362570240,56042,347525,“ওহে ছেলেরা খুশী স্ব-কোয়ারেন্টাইন। করোনার ভাইরাস সত্যই জিনিস is বাহ আমার কোন ধারণা ছিল না! ধন্যবাদ কাইলি! URL টি,125,104,0.832,8,0,0,1,2,0
40,1241054976270614535,51305,129170,"বিশ্ব স্বাস্থ্য সংস্থা তরুণদের সতর্ক করে দিয়েছে: ""আপনি অজেয় নয়” "" কোভিড -১৯ আপনাকে ""কয়েক সপ্তাহের জন্য হাসপাতালে রেখেছিল, এমনকি হত্যা করতে পারে। এমনকি আপনি অসুস্থ না হলেও, আপনি কোথায় যান সে সম্পর্কে আপনার পছন্দ বাছাই করা অন্য কারও জন্য জীবন এবং মৃত্যুর মধ্যে পার্থক্য হতে পারে ”""",276,274,0.9927536231884058,11,0,0,0,0,1
41,1240847006907711490,49611,254071,এই মানুষ হাসপাতালের বিল আউট এত বেশি হতে হবে।,42,42,1.0,1,0,0,0,0,1
42,1241699484469526531,50803,70074,স্পেনের একটি হাসপাতালের ভিডিও। এটা দেখ. ভলিউম আপ সঙ্গে আবার এটি দেখুন। এখন সেই ব্রঞ্চটি বাতিল করুন। যে কফি মিলন আপ স্থগিত। বৃষ্টি বন্ধুদের সাথে ডিনার চেক। চুষছে না তাই না? তবে এই কোভিড 19 করোনভাইরাস স্থায়ী URL এর মতো শক্ত নয় hard,274,242,0.8832116788321168,23,1,1,0,0,0
43,1242087413868003333,49238,340223,যখন আপনি একজন গোলরক্ষক হন ... এবং একমাত্র শিশু ... স্ব-বিচ্ছিন্নতায় ... এবং আপনার প্রশিক্ষণের সাথে চালিয়ে যাওয়ার চেষ্টা করছেন ... নিজেই এই বিষয়টি সামনে এল! আমি খুব মুগ্ধ করোন ভাইরাস স্টিহোমেস্টেফেস ইউআরএল,215,191,0.8883720930232558,12,0,0,1,1,0
44,1240789646893821953,45875,117152,কোভিড -১৯ বড় হতে পারে তবে আমি আপনাকে কেবল মনে করিয়ে দিতে চাই যে আমাদের godশ্বর বড়।,79,78,0.9873417721518988,9,0,0,0,0,0
45,1242131768662282243,59435,271463,সিডিসি সবেমাত্র ঘোষণা করেছে যে করোনাকে ইনস্টাগ্রামের গল্পের চ্যালেঞ্জগুলির মাধ্যমে ছড়িয়ে দেওয়া যেতে পারে: - /,79,79,1.0,4,0,0,0,0,1
46,1241225019952263170,45726,71877,"কেটি পোর্টারের বোন, একজন চিকিত্সক, কোভিড -১৯ সংকটের সময়ে কীভাবে থাকার ফলে জীবন বাঁচাতে পারে তা ভেঙে দিচ্ছেন",130,110,0.8461538461538461,10,0,0,0,0,1
47,1240805124143906816,44451,139394,"আর কেউ এলোমেলোভাবে কার্ডির কণ্ঠে ""করোনার ভাইরাস"" চেঁচাচ্ছে?",65,65,1.0,4,1,1,0,0,0
48,1241745355957514241,45126,100141,"নাগরিকত্বের মর্যাদা নির্বিশেষে এই কর্মীদের সুরক্ষা, স্বাস্থ্যসেবা এবং অসুস্থ বেতনের প্রয়োজন। তাদের পরিষেবাগুলি অপরিহার্য এবং এই সমস্যাটি নিয়ে আরও আক্রমণাত্মক সংলাপ হওয়া দরকার। এগুলি ছাড়া জীবন কেমন হবে? আমি জানতে চাই না!",246,246,1.0,44,1,1,1,1,0
49,1240852412203589632,47696,139193,আমি: এইচ- আমার মা হোয়াটসঅ্যাপ থ্রেড থেকে স্নাতক হওয়ার পরে করোনার ভাইরাসে তার পিএইচডি সহ: ইউআরএল,107,86,0.8037383177570093,6,0,0,0,0,0
50,1241952866404687872,35984,86771,একে অপরের দেখাশোনা করে কোভিড ১৯ কে কাটিয়ে উঠার আশ্বাসের বিটিএসের বার্তাটি দেখুন! আমরা বার্তা চালিয়ে যাওয়ার জন্য পুত্র হিউং-মিনকে আমন্ত্রণ জানাই! ইউআরএল থাকুন সংযুক্ত থাকুন স্ট্রং_আরমি _ বিটিএস নিজেকে হিংসাকে শেষ করে,237,191,0.8059071729957806,32,0,0,1,2,0
51,1240683123362406410,43816,300077,শ্বেত লোকৰ কোবিড -১৯ জন কৃষ্ণগোষ্ঠী: রোনার সমকামী মানুষ: মিস রনা,76,67,0.881578947368421,17,0,0,0,0,0
52,1240831248861474816,42605,141986,কর্নো সিিস তুমি চলে যাচ্ছ ঠিক? URL টি,60,40,0.6666666666666666,3,1,1,0,0,0
53,1240714976060248064,46718,245654,বাহ ... আজ সকালে তোলা .... টিবিএইচ করোন ভাইরাস ইউআরএল এর আগে কখনও ভ্যাগাসকে এই খালি দেখেনি,103,82,0.7961165048543689,4,0,0,0,0,0
54,1240618235499819008,49370,302708,"একটি বাজে ফ্লু ছিল যা ডিসেম্বরে / শুরুর দিকে জান্নাতে গিয়েছিল। আমি আপনাকে বলছি, এটি করোনার ছিল। খালি পিপিএল অসুস্থ ছিল (আমাকে সহ) আমরা এখন করোনার লক্ষণ হিসাবে যা জানি তা অভিযোগ করে।",190,190,1.0,5,0,0,0,0,1
55,1240630649192677378,38278,266962,"সুতরাং, কোভিড -১৯-এর সমস্ত জিনিস আপ করার কারণে, আমি ভেবেছিলাম 'কেন আমাদের একটি টুইটার প্রম নেই?' সুতরাং, আরও অ্যাডো না করে, আমি আপনাকে আমার সমস্ত টুইটার প্রোম আমন্ত্রণ জানাই! আপনি কাউকে আপনার বন্ধু বা অংশীদার হিসাবে আপনার সাথে যেতে বলতে চাইতে পারেন। প্রচার 25 মার্চ অনুষ্ঠিত হবে। যোগদানের জন্য ইন্টারেক্ট করুন!",280,276,0.9857142857142858,14,1,1,1,2,0
56,1241439824239906817,43377,182650,ব্যাটম্যান এখন টেবিল bussing। সময় কঠিন।,41,41,1.0,2,0,0,0,0,0
57,1241986189437087744,47115,35037,এটি থেকে এই ইউআরএল,62,21,0.3387096774193548,4,0,0,0,0,0
58,1241385872001384449,37520,149432,"today we lost 2 colleagues, a young adult cardiology fellow &amp; a medical oncologist due to covid-19 . we pause to pray for them, and yet this war is just starting, with no end in sight! we ask for your prayers we ask our politicians to help and aggresively act for support!",279,276,0.989247311827957,11,0,0,1,2,1
59,1240690021759238144,61515,371022,চীন এর চেয়ে 24 গুণ বেশি মানুষ ...,44,44,1.0,2,0,0,0,0,1
60,1241050910085840903,38541,156419,"after this is all over, please remember in future job interviews to ask them what their company did to protect their employees with regards to the global covid-19 situation. can't be risking working for wayward companies.",221,221,1.0,7,0,0,0,0,0
61,1242136816469389316,35373,147136,15 বছর আগে করোনার ইউআরএলের বিরুদ্ধে লড়াই করে আমার ফ্লিনস্টোনস আঠালো,82,60,0.7317073170731707,5,0,0,0,0,1
62,1240797127539920896,45888,126643,তবে দু'জনে ইউআরএল বলেছেন —,45,25,0.5555555555555556,5,0,0,0,0,0
63,1240340480342310915,98068,550226,"ওহে. হ্যাঁ, এটি চীন থেকে উদ্ভূত হয়েছিল, তবে প্রযুক্তিগত শব্দটি কোভিড -১৯ আপনার মায়ের বুক স্কাইল্লার্কের পিছন থেকে উত্থিত হয়েছিল, তবে আমরা তাকে জুডিথ মানে না বলে আখ্যায়িত করি।",164,159,0.9695121951219512,9,0,0,0,0,1
