,tweet_id,retweet_count,favorite_count,cleaned_tweet,length_before,length_after,ratio_of_length,number_of_upper_chars,has_question_marks,number_of_question_marks,has_exclamations,number_of_exclamation_marks,label
206,1235777621604134914,6571,5060,"এইটি পেয়েছে: হিশাম হামদানের ব্যক্তিগত বিবৃতি, কোভিড -১৯ @ কেস ২ 26। এটি পড়ুন। চোখের খোলার। URL টি",118,97,0.8220338983050848,25,0,0,0,0,0
207,1235788666737291264,3810,6145,টরন্টোর কোভিড ১৯ এর আরেকটি ঘটনা রয়েছে যিনি ..... লাস ভেগাসে সংক্রমণটি পেয়েছিলেন in আপনি ঠিক শুনেছেন - লাস ভেগাস। মার্কিন যুক্তরাষ্ট্র কেস রফতানি করছে এবং ভ্রমণের ইতিহাস দ্রুত অপ্রাসঙ্গিক হয়ে উঠছে। URL টি,238,214,0.8991596638655462,18,0,0,0,0,1
208,1235909436033699847,3479,7921,"ব্রেকিং: বিশ্বব্যাপী এখন করোন ভাইরাসের এক লক্ষেরও বেশি ঘটনা ঘটেছে। কোভিড ১৯ এর ফলে ৩৩৯৯৮ জন মারা গিয়েছেন এবং ৫৫,672২ জন পুনরুদ্ধার করেছেন।",146,144,0.9863013698630136,14,0,0,0,0,1
209,1235402290997141505,7006,14437,"আমি আজ করোনাভাইরাসতে উপস্থিত প্রতিটি কাগজ পড়ার সিদ্ধান্ত নিয়েছি। আমার ব্যাকগ্রাউন্ডটি জীববিজ্ঞান এবং স্নায়ুবিজ্ঞান এবং আমি প্যারাবোলিক প্রবণতাগুলি প্রারম্ভিক, ডেটা এবং চিকিত্সা গবেষণার সাথে আকস্মিক হয়ে পড়েছি। এখানে সর্বশেষ গবেষণার সাথে একটি থ্রেড নিখরচায় রিটুইট বা ক্রেডিট সহ উদ্ধৃত করতে পারেন",279,275,0.985663082437276,9,0,0,0,0,0
210,1235913020469108737,4655,29727,আমি যারা করোন ভাইরাস দ্বারা অসুস্থ এবং তাদের যত্ন নিচ্ছেন এমন স্বাস্থ্যসেবা কর্মীদের পাশাপাশি সিভিল কর্তৃপক্ষ এবং রোগীদের সহায়তা করার ক্ষেত্রে এবং ভাইরাসের বিস্তারকে যুক্ত করার জন্য যারা জড়িত তাদের প্রতি আমার ঘনিষ্ঠতাটি আবার প্রকাশ করতে চাই।,250,249,0.996,1,0,0,0,0,0
211,1235248869463732224,7137,19757,"Hmmm। তবুও যদি এটি হ্যারি এবং মেঘান ছিল যে এটি সম্পর্কে রসিকতা করেছিল, তবে এটি ""মেঘন নিখরচায় ব্রিটিনের নিরীহ নাগরিকদের জন্য মৃত্যু কামনা করে""",137,137,1.0,7,0,0,0,0,0
212,1236029221706895360,6018,6030,"breaking: trump could still own stock in a company that, according to the cdc, will play a major role in providing coronavirus test kits to the federal government, which means that trump could profit from coronavirus testing. covid19 coronavirus URL",273,249,0.9120879120879121,22,0,0,0,0,1
213,1235631509983412224,3342,6868,জোনস হপকিন্স বিশ্ববিদ্যালয়ের @ জুস্টিস্টেমের ইউআরএল ইউআরএল দ্বারা চিহ্নিত করোনাভাইরাস কোভিড -১৯ টি বিশ্বব্যাপী মামলা,134,94,0.7014925373134329,21,0,0,0,0,0
214,1235635838052175878,55310,171857,"আপনি কি জানেন যে এই মুহুর্তে কোভিড -19-এর 96,950 টি কেস রয়েছে? আপনি কি জানেন যে এটি থেকে 3,308 জন মারা গেছে? তবে আপনি কি জানেন যে এর মধ্যে 53,981 টি মামলা ইতিমধ্যে পুনরুদ্ধার হয়েছে? মিডিয়া আপনার মস্তিষ্ক নিয়ন্ত্রণ করতে দেওয়া বন্ধ করুন। ভীতি কৌশল হ'ল বাস্তব কৌশল। আপনার গবেষণা করবেন।",278,275,0.9892086330935251,12,1,3,0,0,1
215,1235740278901723136,3187,8699,"প্রিয় @vp পেন্স: নীচে সত্য? তোমার কোন পরিকল্পনা আছে? এছাড়াও, স্থানীয় এখতিয়ারগুলি যখন আপনার প্রতিশ্রুতি দিয়েছিল করোনভাইরাস পরীক্ষার কিট পেতে চলেছে?",144,142,0.9861111111111112,8,1,3,0,0,0
216,1235760705741127683,11789,7351,আমি একটি মাদুর সাল্লেহ বসের সাথে কাজ করি এবং প্রতিবার যখন কেউ কাউকে হাঁচি বা কাশি শুনেন তিনি তত্ক্ষণাত্ ফিরে যেতে বা বাড়ি থেকে কাজ করতে বলতেন। আমাদের এশিয়ানদের বিষয়টি হ'ল আমরা সবসময়ই মনে করি রজনীন ডিটিজি কার্জা ওয়ালাপুন শাকিত এত উত্সর্গীকৃত তবে আপনি কেবল জীবাণু ছড়াচ্ছেন না .....,279,279,1.0,76,0,0,0,0,1
217,1235953286961913857,3219,4052,same people used in multiple photos for corona claims in different cities across the world &gt;&gt;33 is a prevalent number apparently. URL,160,139,0.86875,6,0,0,0,0,1
218,1236059089630908419,5618,16982,"ফেডারেল সরকার কোভিড -১ testing পরীক্ষায় পা টেনে আনার কয়েক সপ্তাহ পরে, ট্রাম্প কেবল ক্যামেরার সামনে স্বীকার করেছেন যে তিনি তার ব্যক্তিগত রাজনৈতিক সুবিধার জন্য এই প্রাদুর্ভাবের পরিমাপটি কাজে লাগাতে চান।",211,211,1.0,9,0,0,0,0,1
219,1235963807584915457,3724,1957,"tomorrow this boomer is turning 25.. i will leave be going to france for skiing + maybe get corona virus, so i will be mostly afk. to celebrate i am giving this cool nomad knife away. just retweet to enter. picking a random winner when i am home! &lt;3 URL",283,256,0.9045936395759717,16,0,0,1,1,1
220,1235719492493172737,2110,4134,"today’s coronavirus recap: -95,270 confirmed cases globally &amp; 3,281 deaths -80% of new cases in -@who estimates ~3.4% of covid19 cases have died -“it is a time for pulling out all the stops” -@drtedros -countries must take a comprehensive, all-government approach",283,267,0.9434628975265018,13,0,0,0,0,1
221,1235795983503630336,2908,26369,আমি আমার হাত ধোয়া: [বাই শ্যারোনা ভয়েস] ডাই করোনা,51,51,1.0,0,0,0,0,0,0
222,1235927534308556802,3436,31069,রিপ দাদা আমরা কি 30 গিফটেড সাব পেতে পারি? ',39,39,1.0,4,1,1,0,0,0
223,1235723999897882624,2323,5258,wtaf?!?! কোভিড ১৯-এর লক্ষণযুক্ত ডার্টমাউথের একজন ব্যক্তিকে পরীক্ষার ফলাফলের জন্য অপেক্ষা করার সময় স্বতঃসংশ্লিষ্টতা জিজ্ঞাসা করা হয়েছিল। তিনি সিদ্ধান্ত নিয়েছিলেন যে তিনি ভাল আছেন এবং একটি পার্টিতে যান। পরের দিন ইতিবাচক ফলাফল ফিরে এসেছিল। এখন অন্য একটি আছে। এত লোক কেন এটাকে রসিকতা বলে মনে করছে? coronavirususa,277,274,0.9891696750902527,21,1,3,1,2,1
224,1235618874621558791,5484,12534,what works in stopping the spread of coronavirus: 1. wash your hands for at least 20 seconds 2. cough and sneeze into your elbow 3. stay home if you're sick what doesn't work: 1. racism,186,185,0.9946236559139785,7,0,0,0,0,1
225,1235743728247037952,2570,7185,"এখানে আমার পাবলিক সার্ভিসের ঘোষণাটি দেওয়া হয়েছে: যদি @ রিয়েলডোনাল্ড ট্রাম্প কর্নাভাইরাসঘটনার বিষয়ে ডাক্তার এবং বিশেষজ্ঞরা যা বলেছেন তার সাথে বিরোধে কিছু বলে বা টুইট করেন, তবে চিকিত্সক এবং বিশেষজ্ঞদের বিশ্বাস করুন। আপনার জীবন এবং আপনার পরিবার এবং বন্ধুদের জীবন ঝুঁকিতে পড়তে পারে।",262,261,0.9961832061068703,7,0,0,0,0,0
226,1235281112684843009,12944,36274,কোভিড -১৯ সম্পর্কে ভীতিকর বিষয়টি হ'ল এটি জিরা টিকিটের মতো দেখাচ্ছে,69,69,1.0,9,0,0,0,0,0
227,1235791843926761475,75461,284929,vietnam was the first country to fully contain sars and covid-19 (with no deaths) and developed a quick-test kit in one month that the who says should have taken four years. who is now consulting with vietnam to get help for the global crisis. of course this isn't in our news.,277,277,1.0,18,0,0,0,0,1
228,1234747040669716482,118800,438115,"করোনার ভাইরাসে আক্রান্ত হয়ে মারা যাওয়া মানুষের তুলনায় প্রতি বছর নিয়মিত চোখে ফ্লুতে বেশি লোক মারা যায়, কাশির সময় আপনার মুখগুলি আপনার মুখটি ধুয়ে ফেলুন কাশি যখন আপনার চোদন ভিটামিন গ্রহণ করে এবং আপনি এশিয়ান ব্যক্তির প্রতি বর্ণবাদী হওয়া বন্ধ করেন যে আপনি দেখেন যে আপনি মাথা কাটাচ্ছেন",263,263,1.0,216,0,0,0,0,1
229,1235714090057830402,2504,28011,অনুবাদ - একটি 60 বছর বয়সী মহিলা ঠান্ডা ধরা পড়েছিল এবং ভাল আছেন।,60,60,1.0,2,0,0,0,0,1
230,1235669879027576833,2261,8053,এটি করোনার সময় ইউআরএল,40,20,0.5,7,0,0,0,0,0
231,1235506614272241664,7281,21093,"এটিকে প্রথম না দেখে করোনভাইরাস থেকে মারা যাবেন না, এটি আপনি এই বছর দেখছেন এমন সেরা ক্লিপ। covid_19 বৃহস্পতিবারে তৃতীয় বৃহস্পতিবার সম্প্রসারণ করোন ভাইরাস ইউআরএল",182,156,0.8571428571428571,11,0,0,0,0,0
232,1236048815754326016,5094,11968,কোভিড 19 পরীক্ষার অবিচ্ছিন্নতা @ রিয়েলডোনাল্ড ট্রাম্প দ্বারা কর্তব্যকে হ্রাস করা। করণোভাইরাস সম্পর্কে জান থেকে তিনি জানতেন। বিশেষত লজ্জাজনকটি হ'ল @ পোটাস ভাইরাসটি বন্ধ হয়ে গেছে বলে টেস্টিংয়ের অভাবে কৃত্রিমভাবে বিচ্ছিন্ন সংখ্যাগুলি ব্যবহার করছেন। এটা না।,277,273,0.9855595667870036,60,0,0,0,0,1
233,1235347146850914306,26148,158000,"যদি আমি করোনাকে পেয়েছিলাম তবে আমি সেই পাগল টিবিএইচ হতে পারব না। শোষণ এবং স্টাফগুলি ধরে রাখতে, পড়তে, একগুচ্ছ লিখতে এবং আমি ভাগ্যবান হলে, মারা",156,156,1.0,0,0,0,0,0,0
234,1234245348572487682,206397,413443,এটি করোনার ভাইরাসে আমি যে তথ্য পেয়েছি তার মধ্যে এটি সেরা সেট এবং এটি পুরো 10 মিনিটের ইউআরএল দেখার পক্ষে উপযুক্ত,119,99,0.8319327731092437,8,0,0,0,0,0
235,1235754913264779270,1889,10158,করোনাভাইরাস করোন ভাইরাস চ্যালেঞ্জ ইউআরএল সহ সাধারণ অসুস্থ মানুষ vs,89,68,0.7640449438202247,10,0,0,0,0,0
236,1235811829751799810,1944,11357,সাম্প্রদায়িক বিদ্বেষের ভাইরাস করোনার ভাইরাসের চেয়ে মারাত্মক!,59,59,1.0,2,0,0,1,1,0
237,1235785921318072320,2138,5436,"attempt by @realdonaldtrump to minimize coronavirus has not aged well. according to @nytimes, there are over 215 cases &amp; 14 deaths, including 56 new cases today. due to lack of testing by administration, we still don’t know extent of the virus spread. URL",281,259,0.9217081850533808,10,0,0,0,0,1
238,1235617743161815041,2546,7819,করোনার ভাইরাস অস্থায়ী। ঘরের সংগীত চিরকালের জন্য,50,49,0.98,4,0,0,0,0,0
239,1235941267047174150,1894,4038,আপনার অনুমোদনের নম্বরগুলি সাহায্যের জন্য করোনাভাইরাস ভুক্তভোগীদের পরীক্ষা অস্বীকার করা হত্যার চেষ্টা বলে বিবেচিত হওয়া উচিত। URL টি,129,109,0.8449612403100775,4,0,0,0,0,0
240,1235801885354758144,3079,7134,করোনভাইরাস 19 টি বাতিল! URL টি,60,37,0.6166666666666667,11,0,0,1,1,0
241,1236060750210387970,6094,29801,আপনি করোনার বিষয়ে টুইট করছেন কিন্তু কর্ণিশিয়ান স্মেথ নয়,51,51,1.0,1,0,0,0,0,0
242,1235350438658134019,4976,11612,পুরো সমগ্র বিশ্ব: করোনার ভাইরাস বিপজ্জনক। জ্যামাইকানস: ইউআরএল,86,65,0.7558139534883721,7,0,0,0,0,0
243,1235882155357728771,2050,16442,"ইউআরএল ইউআরএল ""আপনি দেখতে পাবেন যে কফিন এটি সেখানে""",89,48,0.5393258426966292,5,0,0,0,0,0
244,1236071277955252226,9802,47001,"প্রতিকূল মহাশূন্য এলিয়েনদের আক্রমণের মতো কোভিড -১৯ হ'ল ​​মানব প্রজাতির শত্রু যা আলোচনা করবে না। এটি আপনার জাতীয়তা, আদর্শ, রাজনীতি বা ধর্মের বিষয়ে চিন্তা করে না। আমাদের সকলের এই শত্রুটির বিরুদ্ধে লড়াই করার বিশ্বব্যাপী প্রচেষ্টা প্রয়োজন, বিজ্ঞানের দ্বারা পরিচালিত এবং যাদুকরী চিন্তাভাবনার দ্বারা নয়। URL টি",300,280,0.9333333333333333,10,0,0,0,0,1
245,1235966384053485568,1934,6611,"শুক্রবার এর মাথাই ফুক্স, আপনি করোনার রস এবং একটি শ্বাস প্রশ্বাসের মুখের সাথে ভরা বাদামের বস্তা দিয়ে দেখিয়ে দিচ্ছেন .....",110,110,1.0,3,0,0,0,0,0
246,1235586819795947521,3374,4528,ভিডিও: মক্কার পবিত্র মসজিদে পবিত্র কাবার চারপাশের অঞ্চলটি করোন ভাইরাসের ভয়ের কারণে এবং তীর্থযাত্রীদের সুরক্ষার জন্য অস্থায়ীভাবে এটিকে পরিষ্কার ও জীবাণুমুক্ত করার জন্য লোকেদের খালি করা হয়েছিল। URL টি,231,208,0.9004329004329005,16,0,0,0,0,1
247,1235521471587299329,5914,23519,টিকটকে সরকারীভাবে দোহ! এই টিকটোক ভিডিওতে কোভিড -19 এর বিরুদ্ধে সুরক্ষামূলক ব্যবস্থা শিখুন! সমবায় চ্যালেঞ্জ যোগদান! আইডিতে দোহের অফিসিয়াল টিকটোক অ্যাকাউন্টটি অনুসরণ করুন: দোহগোভ ইউআরএল,205,179,0.8731707317073171,44,0,0,1,3,0
248,1235703439688175618,2339,3921,"প্রাথমিকভাবে অস্বীকার করার জন্য এবং পরে কোভিড ১৯ পরীক্ষা করতে দেরি করার জন্য একজন নার্স - করোনাভাইরাসের সংস্পর্শে এবং পৃথক রোগে অসুস্থ — হাতুড়ি @ সিডিসিগোভকে। ""কী হাস্যকর এবং অশিক্ষিত প্রতিক্রিয়া ... এটি জনস্বাস্থ্যের জরুরি অবস্থা” "" এইচ / টি @ আইআম_ব্রোকস্মিথ @ জাতীয়করণের ইউআরএল",272,246,0.9044117647058824,32,0,0,0,0,1
249,1235912217943355392,2078,3524,"মার্চ 6th ষ্ঠ বিকাল ৩ টায় কেএসটি হিসাবে বিটিসর্মি প্রায় দান করেছিলেন। 50 দিনের মধ্যে কোভিড -19 ত্রাণের জন্য 505,500,000 জিতেছে !! @bts_twt ইউআরএল",140,109,0.7785714285714286,27,0,0,1,2,1
250,1235735428872974340,1574,3653,"রাষ্ট্রপতি ট্রাম্প কোভিড -১৯ এর জন্য একটি নিরাময়ের ব্যবস্থা করতে পারেন এবং আমরা টিডিএস ভিড়ের কাছ থেকে 'আমার নিরাময় নয়' শুনতাম। তারা বলে আমরা একটি সম্প্রদায়, যখন বাস্তবে আমরা পরিবার। টিম ট্রাম্প একটি রাজবংশ এবং এই রাজবংশ তাকে পুনরায় নির্বাচিত করতে চলেছে। landslide2020",236,233,0.9872881355932204,14,0,0,0,0,0
251,1235751746107879424,1877,3741,"@ রিয়ালডোনাল্ড ট্রাম্প এবং ক্রোনিজ করোনাভাইরাসউব্রেককে ছাড়িয়ে যাওয়ার পরে, পেন্স এখন স্বীকার করেছে যে পর্যাপ্ত করোনভাইরাস টেস্ট কিট নেই। বিশেষজ্ঞরা (আমাকে সহ) কয়েক সপ্তাহ ধরে এটি দেখতে পেয়েছেন এবং পয়েন্ট-অফ-কেয়ার কোভিড ১৯ টি পরীক্ষার আহ্বান জানিয়েছেন। তাদের অক্ষমতা জীবন ব্যয় করতে হবে। @thespybrief",279,272,0.974910394265233,13,0,0,0,0,1
252,1235661301835235328,1898,2122,হংকংগাররা উপযুক্ত কারণেই তাদের নিজস্ব সরকারকে না শোনার সিদ্ধান্ত নিয়েছিল এবং নিজেদের সুরক্ষার জন্য মুখোশ পরার সিদ্ধান্ত নিয়েছিল। এই তালিকার বেশিরভাগ দেশের তুলনায় হংকংয়ের করোনভাইরাস পথে প্রথম ঘটনা ঘটেছে এবং এর পরে এর ক্ষেত্রে প্রায় কোনও কমই দেখা যায়নি।,279,276,0.989247311827957,4,0,0,0,0,1
253,1235778760932196357,2745,10066,সুতরাং স্থানীয় সংক্রমণ আছে। আপনার হাত ধুয়ে নিন দয়া করে মানুষের কাশি বা হাঁচিবেন না।,95,95,1.0,3,0,0,0,0,0
254,1235407182168023040,4735,22770,"কেরালা ভারতের একমাত্র রাজ্য যা সফলভাবে ৩ টি মারাত্মক ভাইরাস, করোনা, নিপা এবং বিজেপি বন্ধ করেছিল।",99,99,1.0,7,0,0,0,0,1
255,1235676894026231812,2373,2986,this latest report of sars-like lung damage is consistent with prior clinical reports of coronavirus cases from china. at least 1 patient who survived covid19 later received a lung transplant due to permanent fibrosis ('scarring') of his lungs. URL,272,248,0.9117647058823529,16,0,0,0,0,1
256,1234756199335133184,11560,9633,আমার বিহুন সুপার সাম্বল হিটম ছাড়া নিখুঁত নয়,49,47,0.9591836734693877,1,0,0,0,0,0
257,1235717251753369600,1671,5107,"মার্কিন সরকারকে দেওয়া অনুদান মার্কিন যুক্তরাষ্ট্রের একটি নির্দিষ্ট অফিস দ্বারা পরিচালিত হয় কোষাগার; আপনি ""স্বাস্থ্যের জন্য সহকারী সচিবের অফিসে"" একটি চেক প্রেরণ করেন না - URL দেখুন",192,171,0.890625,15,0,0,0,0,1
258,1235949880952094720,1618,8524,সুতরাং আজকের জন্য এখানে একটি প্রশ্ন রয়েছে: আপনি যদি সিটল অঞ্চলে ডাক্তার হন তবে আপনি কি আজকের মতো পরীক্ষা করা উচিত বলে মনে করেন এমন কোনও রোগীর জন্য কোভিড -১৯ পরীক্ষা করতে পারেন? এলাকার প্রকৃত চিকিত্সা পেশাদারদের কাছ থেকে শুনতে আগ্রহী।,223,223,1.0,8,1,1,0,0,0
259,1235714445747179520,1883,21051,আমরা কী বলতে পারি যে '16 জনের পরীক্ষা করা হয়েছে',61,61,1.0,0,0,0,0,0,0
260,1235714668833828864,1625,7666,"এই করোনভাইরাস জরুরী প্রতিক্রিয়া প্যাকেজটি আমাদের সরকারকে এই জনস্বাস্থ্য সংকট মোকাবিলা করার জন্য প্রয়োজনীয় সংস্থানগুলি দেয় - অন্যান্য গুরুত্বপূর্ণ উদ্যোগ থেকে একটি পয়সা চুরি না করে। আমার স্বাক্ষর সহ, এটি রাষ্ট্রপতির ডেস্কে যায়। URL টি",261,240,0.9195402298850575,5,0,0,0,0,1
