,tweet_id,retweet_count,favorite_count,cleaned_tweet,length_before,length_after,ratio_of_length,number_of_upper_chars,has_question_marks,number_of_question_marks,has_exclamations,number_of_exclamation_marks,label
116,1240453761434148864,10315,44955,"দুঃখিত, এই সব ""প্রতারণা"" বলে আর ফিরে আসেনি। আমি ""স্বর পরিবর্তন"", """" হৃদয় পরিবর্তন, ""কিছুই"" সম্পর্কে কোন ধাক্কা দিতে না। আপনি মুঠা fuckers একটি গুরুতর পরিস্থিতি নিয়েছিলেন এবং একটি বিরাট রক্ষার জন্য সমস্ত বিপন্ন। তোমাকে চুদব দুঃখিত না. করোনাভাইরাস",262,256,0.9770992366412213,8,0,0,0,0,0
117,1241935299833253891,1558,6216,"গতকাল রাতে উত্তর দিল্লির বিজয় নগর এলাকায় মণিপুরের এক মহিলাকে ঝাঁকুনি দিয়ে তাকে ""করোনা"" বলে অভিযুক্ত ব্যক্তির বিরুদ্ধে দিল্লি পুলিশ ভারতীয় দন্ডবিধির ৫০৯ ধারায় মামলা করেছে। URL টি",237,217,0.9156118143459916,14,0,0,0,0,1
118,1242115593383247873,1763,4492,"ভুয়া খবর ছদ্মবেশী ধ্রুব রাঠি বলেছিলেন: ""করোনার ভাইরাস চীনের বাইরে ছড়াবে না, আমাদের চিন্তার দরকার নেই"" এই ব্যক্তি কি কখনও বুদ্ধিমান কিছু বলেছে? URL টি",171,149,0.8713450292397661,11,1,1,0,0,1
119,1241842361472294915,1656,1860,this photo circulating about a case of covid19 in kano allegedly reported by @bbcworld is false this image has been doctored to spread fear and panic details on confirmed cases can be found via URL factsnotfear covid19nigeria URL,275,229,0.8327272727272728,34,0,0,0,0,1
120,1241962722008465408,1678,2704,"সেন। র‌্যান্ড পল, যে লোকটি করোনভাইরাস ত্রাণ বিলের বিরোধিতা করেছিল এবং অসুস্থ ছুটি দিয়েছিল, ২২ শে মার্চ তার পিতাকে অসুস্থ অবস্থায় রেখে অসুস্থ অবস্থায় ফেলেছে, এবং প্রাক্তন কংগ্রেসম্যান, রন পল, ১ 17 মার্চ “করোনাভাইরাস হ্যাক্স” শীর্ষক একটি প্রবন্ধ প্রকাশ করেছেন। ভন্ডামি মূল ইউআরএল থেকে সংক্রামিত হয়",304,282,0.9276315789473685,30,0,0,0,0,1
121,1242143473710448640,1682,2808,"কখনই ভুলে যাবেন না .. যখন ভারত করোনার সাথে লড়াই করছিল, @ উইনোডকাপ্রির মতো শূকররা কংগ্রেসের প্রচারের জন্য আতঙ্ক তৈরি করার জন্য ভুয়া সংবাদ ভাগ করছিলেন। পাইপের অভাব নেই। অসম মেডিকেল কলেজের শিক্ষার্থীরা পাইপ পরীক্ষা করছিলেন যে অভাব দেখা দিলে কী ব্যবহার করা যায়। URL টি",277,254,0.9169675090252708,24,0,0,0,0,1
122,1241356310555361280,1677,4067,শিয়াল সংবাদ তাদের দর্শকদের ঝুঁকির মধ্যে ফেলে তাদের বিশ্বাস করে কোভিড -19 মহামারীটি একটি প্রতারণা। এই দর্শকরা তখন আমাদের সমগ্র জনসংখ্যাকে ঝুঁকির মধ্যে ফেলে এবং অনেক লোক প্রাণ হারিয়েছে। ফক্স নিউজগুলিকে দায়বদ্ধ করার জন্য একটি শ্রেণিবদ্ধ মামলা মোকদ্দমার মুখোমুখি হওয়া উচিত। foxclassaction,279,272,0.974910394265233,21,0,0,0,0,0
123,1238869710046777344,42644,309015,this isn’t a conspiracy tweet but i really think covid-19 has been here in america for awhile. do you guys remember how sick everyone was during the holidays/early january? and how everyone was saying they had the “flu” and the flu shot “didn’t work”?,251,251,1.0,11,1,2,0,0,0
124,1241134916441722882,1457,2211,ফক্স নিউজ দাবি করেছে যে এটিকে কখনই কোভিড -১৯ বলে একটি প্রতারণা বলা হয়নি। রসিদগুলি পরীক্ষা করে দেখি। URL টি,98,78,0.7959183673469388,14,0,0,0,0,1
125,1242397688961753088,1790,1799,"if u love humanity, then pl stop forwarding any fake msg abt hantavirus to avoid panic, when we already hv enough to fight wid coronavirus. hanta virus spreads only from an infected animal's urine,faeces or saliva. pl educate yourself &amp; rt for others to understand. nofakenews URL",308,284,0.922077922077922,16,0,0,0,0,1
126,1240810239101935616,1530,2462,চিকাগোর বাইরে এখনই করোনভাইরাস জোর করে বিবাদযুক্ত মিলিটারেইন নোটাহোএক্স ইউআরএল,107,82,0.7663551401869159,7,0,0,0,0,0
127,1242393469001150466,1565,2847,"করোনাভাইরাস: ওয়েলটিউজের প্রতিষ্ঠাতা, শেখর গুপ্তা এবং অন্যরা একটি জাল টুইটার অ্যাকাউন্ট ইউআরএল দ্বারা যাচাই করা দাবি ছড়িয়েছে",130,109,0.8384615384615385,10,0,0,0,0,1
128,1241117279556902914,1210,2406,তথ্য মন্ত্রণালয়ের একটি বার্তা “সাধারণ মানুষকে এইভাবে হোয়াটসঅ্যাপে প্রচারিত যে কোনও ভয়েস নোটকে অগ্রাহ্য করার আহ্বান জানানো হয়েছে যে হেলিকপ্টারটি রাত ১১ টা নাগাদ সারা দেশে‘ অ্যান্টিভাইরাস ’স্প্রে করবে। এই সংবাদটি নকল এবং এটি সম্পূর্ণরূপে উপেক্ষা করা উচিত। rt covid19,280,279,0.9964285714285714,17,0,0,0,0,1
129,1241930121570742272,1291,5415,@realdonaldtrump @nytimes @washingtonpost “we are desperate”: 10 nurses &amp; doctors explain what it's like to fight covid19 without enough face masks. how do i know this isn't fakenews? because my kid is an icu nurse in ca. they haven't had enough n95masks from the very start. getmeppe 1/ URL,323,295,0.913312693498452,55,1,1,0,0,0
130,1242443595673522177,1589,3542,- create a fake account - tweet fake news - pidi journalists will rt &amp; quote rt - then the original pidi will quote rt - create panic - say sorry - deactivate the account URL,199,178,0.8944723618090452,21,0,0,0,0,0
131,1242626001479372806,1415,3211,চীনা কমিউনিস্ট পার্টি রাজনৈতিক উদ্দেশ্যে বিশ্ব থেকে কোভিড 19 প্রাদুর্ভাব সম্পর্কে তথ্যকে দমন করে। জবাবদিহিতা গ্রহণের পরিবর্তে তারা সক্রিয়ভাবে সংযুক্ত রাষ্ট্রসমূহের বিরুদ্ধে ষড়যন্ত্র তত্ত্ব প্রচার প্রচার চালাচ্ছে। : @axios / @ hbo ইউআরএল,284,261,0.9190140845070423,16,0,0,0,0,1
132,1240942776629354496,1960,1352,শীর্ষ কোভিড 19-ফেসপাল ডাক্তার মনোনীত 1 ডাঃ এইচটি। সিটি কাউন্সিলের প্রয়োগকারীদের বিরুদ্ধে কারণ তারা এমসিও 2 ডাঃ অ্যাডাম ব্যায়াম করতে চায়। মারার জন্য গরম জল পান করুন। জাল তথ্য। সিউডোসায়েন্স মিথ্যা আশ্বাস 3 ডাঃ ওসমান। পরীক্ষা প্রত্যাখ্যান। চলমান তালিকার ইউআরএলকে চারপাশে প্রত্যেককে সংক্রামিত করুন,304,281,0.9243421052631579,54,0,0,0,0,0
133,1241616962045636608,958,3162,[একক টুইটের সাথে বিশদ দিয়ে আবার টুইট করা যাতে কোনও বিপদাশঙ্কা নেই] ঠিক তেমন: 38-বছর-বয়সী কোভিড 19 ইতিবাচক মানুষ পাটনায় মারা যান। কিডনিতে মারাত্মক সমস্যা রয়েছে যা কাতার থেকে ফিরে আসার পরেই রেনাল ব্যর্থ হতে দেয়। প্রবীণ নাগরিক নন এমন একজনের মৃত্যুকে এটি প্রথম ‘ভাইরাস-সংযুক্ত’ করে তোলে।,279,276,0.989247311827957,12,0,0,0,0,1
134,1241899861403983880,1215,2662,"fearmongering pharmafauci - who built his entire career on the bogus hiv-aid$ causality by pushing a fakescience of the immune system &amp; imperial control of servile academics, now thinks he’ll get away with this current scam upon a petrified coronavirus american public. not!",284,278,0.9788732394366197,23,0,0,1,1,1
135,1241253205406822400,1187,1285,"""কেউ আমার কাছে যেতে চায় না।"" নাইজেরিয়া তার প্রথম পজিটিভ কোভিড ১৯ কেস রেকর্ড করার পরে, একটি গল্প সোশ্যাল মিডিয়ায় ভাইরাল হয়েছিল। এটি দাবি করেছে যে রোগীর ট্যাক্সি ড্রাইভার রোগ ছড়িয়ে না দেওয়ার জন্য অর্থ দাবি করছেন। গল্পটি নকল ছিল, তবে জুডির উপর প্রভাবটি সত্যই ছিল। URL টি",302,280,0.9271523178807947,18,0,0,0,0,1
136,1241836819362299906,1168,4371,"shout out to @gavinnewsom &amp; @nygovcuomo! this is what real leadership looks like. they are kicking ass &amp; doing so w/ empathy &amp; respect, taking care of our citizens while trump is trying to make us believe he changed his mind about calling the coronavirus a hoax!",275,274,0.9963636363636363,11,0,0,1,2,0
137,1242505023600447491,1323,3875,"করোনার সঙ্কট সামাল দেওয়ার ট্রাম্পের সময়রেখা: এক মাস আগে: এটি একটি প্রতারণা। উপচে পড়া দুই সপ্তাহ আগে: এটি গুরুতর। এর বিস্তার রোধ করতে আমাদের অবশ্যই পদক্ষেপ নিতে হবে। এই সপ্তাহে: দ্বিতীয় মুহুর্তে আহ, সম্ভবত এক মিলিয়ন বা আমেরিকান মারা যাচ্ছে * যে খারাপ নয়",260,255,0.9807692307692307,7,0,0,0,0,1
138,1242115861114163201,1324,1759,"know the facts about covid19. don’t share rumors &amp; unintentionally spread misinformation. federal, state &amp; local governments are posting current and accurate information. for help in distinguishing rumor from fact, see @fema coronavirus rumor control: URL URL",308,267,0.8668831168831169,24,0,0,0,0,1
139,1241774256511385602,6755,12000,"কোভিড ১৯-এর আক্রান্ত রোগীদের হালকা থেকে গুরুতর শ্বাসকষ্টজনিত অসুস্থতা রয়েছে। লক্ষণগুলির মধ্যে রয়েছে জ্বর, কাশি বা শ্বাসকষ্ট। কোভিড -19 উপসর্গ সম্পর্কে আরও জানুন: ইউআরএল ইউআরএল",217,176,0.8110599078341014,18,0,0,0,0,1
140,1241272447187419137,986,1098,হানিয়ার ন্যায়বিচার মিনি। @ জুডিত্বর্গা_ইউ সংসদে বিল পাঠিয়েছেন: - ২০২০ সালের শেষ অবধি জরুরি অবস্থা - ডিক্রির মাধ্যমে রায় দিন - সংসদ স্থগিত - কোনও তাত্পর্যপূর্ণ নির্বাচন / গণভোট নয় - জাল সংবাদ এবং গুজব ছড়ায় পাঁচ বছরের কারাদণ্ডের সাজা covid19 ইউআরএল,279,257,0.921146953405018,23,0,0,0,0,1
141,1242322693086760960,863,2724,"watch an airline staff appeals to all not to spread rumours and instead educate yourself &amp; others about covid19, after she gets harassed by people in her housing society for allegedly spreading coronavirus. URL",237,214,0.9029535864978903,16,0,0,0,0,1
142,1242320472718692352,1036,3642,"লজ্জাজনক যে আপনার খ্যাতিমান কোনও ব্যক্তি ভারত এবং এর traditionsতিহ্যের প্রতি অন্ধ ঘৃণা করে ভুয়া সংবাদ / গুজব ছড়ায়। শ্রদ্ধার নিদর্শন হিসাবে ভারত ডাক্তার, স্বাস্থ্য এবং জরুরী কর্মীদের প্রশংসা করার জন্য @ নরেন্দ্রমোডির ডাকে বারান্দায় বেরিয়ে এসেছিল। অন্য কোন কারণ ছিল না। ফ্যাক্ট চেক?",280,280,1.0,7,1,1,0,0,1
143,1241313848939986947,990,2872,"another 'fake news' being peddled in india is india is a country of vegetarians, so it is not going to be affected by coronavirus like china. vegetarianism &amp; corona has no connection. + india's vegetarianism is a myth, 80% indians are meat eaters! URL",278,255,0.9172661870503597,15,0,0,1,1,1
144,1241114836433584130,820,2246,"to-date, uganda has no confirmed case of covid19. there is an article alleging that “uganda confirms 1st case of coronavirus”-this is not true and absolutely fake. people, please stop spreading rumors. our teams are working around the clock to protect you &amp; keep covid out of URL",307,283,0.9218241042345277,29,0,0,0,0,1
145,1241370210575069184,1184,1697,"আমার জালিয়াতির সতর্কতাটি আজ সকালে প্রকাশিত হয়েছে, দয়া করে পড়ুন এবং ভাগ করুন - স্পষ্ট ফিগলিউজি: করোনাভাইরাস কেলেঙ্কারি সতর্কতা: জাল স্টারবাক্স কুপন থেকে করদাতাদের জালিয়াতি পর্যন্ত, কনস ভাইরাস ভাইরাল হচ্ছে @nbcnewsthink @msnbc coronavirus URL",236,214,0.9067796610169492,26,0,0,0,0,1
146,1242373497948491776,812,1737,একটি অনলাইন ওয়েবসাইট ভ্রান্তভাবে জানিয়েছে যে কোভিড ১৯ দ্বারা সৃষ্ট সংকট মোকাবেলায় ভারত ভারতে আর্থিক জরুরি অবস্থা জারি করতে পারে। দয়া করে পরামর্শ দিন যে গল্পটি দূষিত এবং জাল এবং এরকম কোনও পরিকল্পনা নেই। URL টি,262,238,0.9083969465648855,11,0,0,0,0,1
147,1241949968174387200,891,1257,"""চীন এবং কে প্রধান: তাদের উভয়কেই মহামারী হিসাবে জবাবদিহি করুন"": কীভাবে @ কে প্রধান @ ড্রট্রোসস অভিযোগ করেছেন যে কীভাবে চীনের প্রেসিডেন্ট জিজিনপিংকে কয়েক সপ্তাহ ধরে জানুয়ারিতে কোভিড ১৯ এর গোপনীয়তা গোপনে রেখে বিশ্বব্যাপী বিপর্যয় সৃষ্টি করেছিল। পড়ুন! URL টি",268,246,0.917910447761194,25,0,0,1,1,1
148,1240681625756880897,1881,6240,এক মিলিয়ন দিরহাম জরিমানা সোশ্যাল মিডিয়া বা হোয়াটসঅ্যাপে করোনভাইরাস সম্পর্কে কোনও অনিশ্চিত বা ফকিনিউ ভাগ করে নেওয়ার জন্য 5 বছরের জেল এবং নির্বাসন এবং আপনার কাছ থেকে জীবনের জন্য নিষেধাজ্ঞা। uae সরকার এই মহামারী সম্পর্কে শুনেছি সেরা ঘোষণা government আমরা কি পাকিস্তানে এটা করতে পারি?,276,268,0.9710144927536232,16,1,1,0,0,1
149,1241649820273709056,1017,2569,এখনও পর্যন্ত আমি আমার কাছে 2 পিপিএল জানি যা করোনার জন্য ইতিবাচক পরীক্ষা করেছে। দুজনই হাসপাতালে নিউমোনিয়া থেকে সুস্থ হয়ে উঠছেন। এটি কোনও খেলা বা ষড়যন্ত্র নয়। পিপিএল এর শুভকামনা ইত্যাদির দরকার নেই ... তাদের ঘরে থাকা আপনার দরকার,211,211,1.0,6,0,0,0,0,1
150,1241683913535148032,1036,1292,ফ্যাকিনিউজ সতর্কতা পাইফ্যাক্টেকেক: প্যারাসিটামল করোন ভাইরাস সংক্রমণের চিকিত্সা করতে পারে এমন দাবি মিথ্যা! কোভিড ১৯ ইন্ডিয়ায় মিথ্যা প্রতিকার ভাগ করে নেওয়া থেকে সাবধান থাকুন। করোনভিরুসিনিন্দিয়া সম্পর্কিত খাঁটি তথ্যের জন্য অনুসরণ করুন @ মোফডব্লিউ_আইডিএ ইউআরএল,254,225,0.8858267716535433,31,0,0,1,1,1
151,1242514092339925000,993,1382,"কোভিড -১৯ এর উদ্বেগের জের ধরে বন্দী কারাগারে মুক্তি পেয়েছিল বলে অভিযোগ করা হয়েছে মহিলার বাড়ীতে প্রবেশ করে, তাকে নাইটপয়েন্টে বেঁধে রেখেছিল এবং তার ইউআরএল হত্যার হুমকি দিয়েছে",159,139,0.8742138364779874,11,0,0,0,0,1
152,1241665385302306816,843,760,করোনাভাইরাস ফ্যাক্ট চেক হ্যাপ অন এবং আরটি যদি আপনি সমর্থন করেন @ রিয়েলডোনাল্ড ট্রাম্প এই হ্যান্ডেলটি দিয়ে এই টুইট মন্তব্যটি @ যারা বুকমার্ক মন্তব্য করেন তাদের অনুসরণ করুন / ফিরে আসুন @ ভানুরসে 1212 অনুসরণ করুন,256,210,0.8203125,64,0,0,0,0,0
153,1242107392713584642,974,1055,"নমস্কর্ম, এই বার্তা সাদগুরু থেকে নয়। এটি হোয়াটসঅ্যাপে প্রচারিত একটি নকল বার্তা। আমরা আপনাকে এই টুইটগুলি মুছে ফেলার জন্য অনুরোধ করছি।",149,146,0.9798657718120806,6,0,0,0,0,1
154,1241340364830707712,898,1542,"খবরটি জানুয়ারি থেকে শ্রেণিবদ্ধ সুরক্ষা ব্রিফিং ট্রাম্পকে জানিয়েছিল যে একটি মহামারী আসছে। ট্রাম্প কিছুই করেননি, আমাদের বলেছিলেন এটি একটি ""গণতান্ত্রিক প্রতারণা"" এবং পনেরোটি মামলা শীঘ্রই কোনও হবে না। থ্রেড। করোনাভাইরাস ট্রাম্প্প্যান্ডেমিক ট্রাম্প্লিপোপল্ডডি ইউআরএল",280,253,0.9035714285714286,19,0,0,0,0,1
155,1241365063598030849,942,2694,"ট্রাম্পের সিদ্ধান্তহীন নয় এবং কোভিড ১৯ কে কলহিত করার একটি সিদ্ধান্ত ""অচলাবসা"" অনাবশ্যকভাবে লক্ষ লক্ষ ব্যক্তিকে উন্মোচিত করেছে যা সঠিকভাবে সচেতন করা হলে পদক্ষেপ গ্রহণ করতে পারে। রক্তের এমন এক নদী থাকবে যা ট্রাম্পের ক্ষুদ্র হাতকে চিরকাল দাগ দেবে।",214,212,0.9906542056074766,8,0,0,0,0,1
156,1242226084504129537,761,2471,"ট্রাম্প করোনাভাইরাস সম্পর্কে ""আমরা প্রথম দিকে"" বলেছিলেন। 2/26 ""15 দিনের মধ্যে 15 জন (লোক) নীচে নেমে যাচ্ছে 0"" 2/28 ""একদিন, এটি একটি অলৌকিক মত, এটি অদৃশ্য হয়ে যাবে"" 2/28 ""এটি তাদের নতুন প্রতারণা"" 3/12 হ্যাঁ ""এটি চলে যাচ্ছে"" up আমরা প্রথম দিকে ছিল",264,256,0.9696969696969697,7,0,0,0,0,1
157,1240963320322162688,873,3312,actual people telling the world that pakistan is taking precautions against coronaviruspakistan. but our fake media giving only hype &amp; sensationalism. we all have to be one in this war against coronavirus. stay home. stay safe. URL,257,235,0.914396887159533,22,0,0,0,0,1
158,1241587305644724225,608,1473,ম্যাডো - যে মহিলা 4 বছর ধরে মিথ্যা এবং বন্য ষড়যন্ত্রের তত্ত্বগুলি প্যাড করেছেন - ট্রাম্পকে তার কোভিড -19 প্রেসিডেন্টদের শূন্য আত্ম-সচেতনতা বন্ধ করার জন্য আহ্বান জানাচ্ছেন। URL টি,186,157,0.8440860215053764,11,0,0,0,0,1
159,1241156711823572992,574,1707,the fact that people refuse to stop gathering in large groups because they don't believe millions of americans could die is donald trump's fault. you can't tell your constituents that the media lies &amp; science is fake &amp; be shocked when they refuse to take corona seriously.,280,280,1.0,6,0,0,0,0,1
